{
  "tp_id": "TP-PRMS-052",
  "status": "VALIDATED",
  "packet_family": "flight_deck",
  "lane": "closed_loop",
  "summary": {
    "result": "Execution completed successfully and correctly computed state bounds.",
    "key_findings": [
      "Closed-loop behavior verified over 10 iterations.",
      "Implicit action triggers fired correctly.",
      "State was recomputed reliably without data loss."
    ],
    "key_caveats": [
      "Next-action selection fallback was triggered twice during edge-case tests."
    ]
  },
  "acceptance_checks": {
    "passed": [
      "one canonical JSON bundle exists",
      "closed loop simulation finishes without errors"
    ],
    "failed": [],
    "not_applicable": [
      "patch application behavior"
    ]
  },
  "validation": {
    "scenario_count": 5,
    "scenario_summary": [
      "Happy path iteration",
      "Implicit action fallback",
      "Data ingestion edge cases"
    ],
    "coverage_notes": [
      "80% instruction branch coverage in standard operational scenarios."
    ]
  },
  "artifacts": {
    "primary": [
      "TP-PRMS-052_PROOF_BUNDLE.json"
    ],
    "supporting": [
      "CLOSED_LOOP_TRACE.json",
      "IMPLICIT_ACTION_LOG.json",
      "STATE_RECOMPUTE_REPORT.json",
      "NEXT_ACTION_SELECTION_REPORT.json",
      "CLOSED_LOOP_MANIFEST.json"
    ],
    "archive": {
      "present": true,
      "filename": "TP-PRMS-052_PROOF_ARCHIVE.zip",
      "sha256": "abcdef1234567890abcdef1234567890abcdef1234567890abcdef1234567890"
    }
  },
  "manifest": {
    "generated_at": "2026-03-14T20:00:00Z",
    "bundle_schema_version": "1.0"
  }
}
